{"$schema":"https://json-schema.org/draft/2020-12/schema","type":"object","additionalProperties":false,"properties":{"planVersion":{"const":6},"specId":{"const":"SPEC-0001"},"proofPurpose":{"const":"phase-6"},"authorizationId":{"const":"phase-6/v1"},"baseCommit":{"const":"f46ed3b13e6bca3a09c9b2926c972bea8c331f2c"},"dirtyExpectedPaths":{"type":"array","minItems":26,"maxItems":26,"uniqueItems":true,"items":{"type":"string"}},"cleanExpectedPaths":{"const":[]},"outputRoot":{"const":"output/spec-0001/phase-6"},"operationFamilies":{"const":["guarded-http","protected-regression","runner-environment","screenshot","visible-role"]},"registry":{"type":"object"},"selectedActionIds":{"type":"array","minItems":33,"maxItems":33,"uniqueItems":true,"items":{"type":"string"}},"evidence":{"type":"object"}},"required":["planVersion","specId","proofPurpose","authorizationId","baseCommit","dirtyExpectedPaths","cleanExpectedPaths","outputRoot","operationFamilies","registry","selectedActionIds","evidence"]}
